{
  "schema_version": 1,
  "bank_version": "v1",
  "surface": {"id": 3, "key": "fields"},
  "snapshot_date": "2026-09-01",
  "decision": "BANK_REVIEWED",
  "record_count": 618,
  "required_artifacts": [
    {"kind":"semantic_registry","path":"config/product/options-bank-semantic-relations.json","expected_status":"6 relationships / 3 aliases / 3 effective derivations"},
    {"kind":"native_audit","path":"config/product/options-bank-audits/fields-native-wordpress.json","expected_status":"NATIVE_AUDITED"},
    {"kind":"market_audit","path":"config/product/options-bank-audits/fields-market-ecosystem.json","expected_status":"MARKET_AUDITED"}
  ],
  "semantic_expectations": {
    "relationships": 6,
    "aliases": 3,
    "effective_derivations": 3
  },
  "policy_gates": {
    "unreviewed_records": 0,
    "native_unresolved": 0,
    "market_unresolved": 0,
    "semantic_sources_are_noncanonical": true,
    "rejected_unsafe_consistent": true,
    "deferred_consistent": true,
    "wpe_exceed_consistent": true,
    "wpe_exceed_shard_future_only": true,
    "record_delta_after_market_audit": 0
  },
  "unresolved": 0
}
