{
  "schema_version": 1,
  "bank_version": "v1",
  "surface": {
    "id": 2,
    "key": "taxonomy"
  },
  "snapshot_date": "2026-09-02",
  "decision": "BANK_REVIEWED",
  "record_count": 71,
  "required_artifacts": [
    {
      "kind": "semantic_registry",
      "path": "config/product/options-bank-semantic-relations.json",
      "expected_status": "NO_TAXONOMY_SEMANTIC_OVERLAPS"
    },
    {
      "kind": "native_audit",
      "path": "config/product/options-bank-audits/taxonomy-native-wordpress.json",
      "expected_status": "NATIVE_AUDITED"
    },
    {
      "kind": "market_audit",
      "path": "config/product/options-bank-audits/taxonomy-market-ecosystem.json",
      "expected_status": "MARKET_AUDITED"
    }
  ],
  "semantic_expectations": {
    "relationships": 0,
    "aliases": 0,
    "effective_derivations": 0
  },
  "policy_gates": {
    "unreviewed_records": 0,
    "native_unresolved": 0,
    "market_unresolved": 0,
    "semantic_sources_are_noncanonical": true,
    "rejected_unsafe_consistent": true,
    "deferred_consistent": true,
    "wpe_exceed_consistent": true,
    "wpe_exceed_shard_future_only": true,
    "record_delta_after_market_audit": 0
  },
  "unresolved": 0
}
