{"schema_version":1,"bank_version":"v1","surface":{"id":9,"key":"listings"},"snapshot_date":"2026-09-02","decision":"BANK_REVIEWED","record_count":150,"required_artifacts":[{"kind":"semantic_registry","path":"config/product/options-bank-semantic-relations.json","expected_status":"0 Surface 9 alias/effective-derivation entries required by the reviewed candidate; existing registry remains shared and unchanged"},{"kind":"native_audit","path":"config/product/options-bank-audits/listings-native-wordpress.json","expected_status":"NATIVE_AUDITED; 14 dispositions and zero unresolved items"},{"kind":"market_audit","path":"config/product/options-bank-audits/listings-market-ecosystem.json","expected_status":"MARKET_AUDITED; 4 primary providers, 2 specialists, 32 family mappings, 8 Bank references, 4 explicit dispositions and zero unresolved items"}],"semantic_expectations":{"relationships":0,"aliases":0,"effective_derivations":0},"policy_gates":{"unreviewed_records":0,"native_unresolved":0,"market_unresolved":0,"semantic_sources_are_noncanonical":true,"rejected_unsafe_consistent":true,"deferred_consistent":true,"wpe_exceed_consistent":true,"wpe_exceed_shard_future_only":true,"record_delta_after_market_audit":0},"unresolved":0}