{"schema_version":1,"bank_version":"v1","surface":{"id":24,"key":"backup"},"snapshot_date":"2026-10-19","decision":"BANK_REVIEWED","record_count":122,"required_artifacts":[{"kind":"semantic_registry","path":"config/product/options-bank-semantic-relations.json","expected_status":"0 Surface 24 relationships, aliases or effective derivations; current registry contains only Surface 3 Fields entries"},{"kind":"native_audit","path":"docs/PRODUCT/BACKUP-NATIVE-WORDPRESS-AUDIT-V1.md","expected_status":"Native audit evidence complete for all 122 records; WordPress DB/filesystem/plugin-theme/cron/multisite/maintenance/Site Health primitives classified as substrate; zero native unresolved items; no capture, archive, upload or restore claim"},{"kind":"market_audit","path":"config/product/options-bank-audits/backup-market-ecosystem.json","expected_status":"MARKET_AUDITED; 4 primary providers, 11 specialists, 248 Bank references, 6 extra dispositions and zero unresolved items"}],"semantic_expectations":{"relationships":0,"aliases":0,"effective_derivations":0},"policy_gates":{"unreviewed_records":0,"native_unresolved":0,"market_unresolved":0,"semantic_sources_are_noncanonical":true,"rejected_unsafe_consistent":true,"deferred_consistent":true,"wpe_exceed_consistent":true,"wpe_exceed_shard_future_only":true,"record_delta_after_market_audit":0},"unresolved":0}
