{"schema_version":1,"bank_version":"v1","surface":{"id":28,"key":"media"},"snapshot_date":"2026-10-20","decision":"BANK_REVIEWED","record_count":232,"required_artifacts":[{"kind":"semantic_registry","path":"config/product/options-bank-semantic-relations.json","expected_status":"Zero Surface 28 aliases/relationships/effective derivations; canonical owners remain Surface 28 media policy, Surface 45 reference mutation, Surface 53 fonts, Surface 23 remote connections, Surface 26 portability."},{"kind":"native_audit","path":"docs/PRODUCT/MEDIA-OPERATIONS-NATIVE-WORDPRESS-AUDIT-V1.md","expected_status":"Current Core media substrate classified across all 232 records; no runtime or editor-format certification claim."},{"kind":"market_audit","path":"config/product/options-bank-audits/media-market-ecosystem.json","expected_status":"MARKET_AUDITED; 6 primary product sources, 9 specialist sources, 1 native Core reference, 232 record dispositions and zero unresolved items."}],"semantic_expectations":{"relationships":0,"aliases":0,"effective_derivations":0},"policy_gates":{"unreviewed_records":0,"native_unresolved":0,"market_unresolved":0,"semantic_sources_are_noncanonical":true,"rejected_unsafe_consistent":true,"deferred_consistent":true,"wpe_exceed_consistent":true,"wpe_exceed_shard_future_only":true,"record_delta_after_market_audit":0},"unresolved":0}
