{"schema_version":1,"bank_version":"v1","surface":{"id":15,"key":"membership"},"snapshot_date":"2026-09-13","decision":"BANK_REVIEWED","record_count":15,"required_artifacts":[{"kind":"semantic_registry","path":"config/product/options-bank-semantic-relations.json","expected_status":"0 Surface 15 relationships, aliases or effective derivations; current registry contains only Surface 3 Fields entries"},{"kind":"native_audit","path":"docs/PRODUCT/MEMBERSHIP-NATIVE-WORDPRESS-AUDIT-V1.md","expected_status":"Accepted native audit evidence complete for the 15-record Bank; WordPress has no native membership-plan engine; integrated by PR #712; canonical Surface 15 status NATIVE_AUDITED with zero remaining native Bank blockers"},{"kind":"market_audit","path":"config/product/options-bank-audits/membership-market-ecosystem.json","expected_status":"MARKET_AUDITED; 2 primary providers, 1 specialist, 27 Bank references, 2 extra dispositions and zero unresolved items"}],"semantic_expectations":{"relationships":0,"aliases":0,"effective_derivations":0},"policy_gates":{"unreviewed_records":0,"native_unresolved":0,"market_unresolved":0,"semantic_sources_are_noncanonical":true,"rejected_unsafe_consistent":true,"deferred_consistent":true,"wpe_exceed_consistent":true,"wpe_exceed_shard_future_only":true,"record_delta_after_market_audit":0},"unresolved":0}
